{
  "region": "shoulder",
  "title": "Shoulder Region",
  "source_file": "Shoulder Region.docx",
  "extracted_at": "2026-02-04T03:56:25.617Z",
  "conditions": [
    {
      "name": "Initial Assessment",
      "entry_criteria": [],
      "questions": [
        {
          "id": "shoulder_q1",
          "question": "What region is pain present in?",
          "category": "location",
          "answers": [
            {
              "value": "Shoulder",
              "effects": {
                "rule_out": [],
                "increase_likelihood": [],
                "decrease_likelihood": [],
                "next_questions": [],
                "red_flag": false,
                "red_flag_text": null,
                "notes": null
              }
            },
            {
              "value": "Clavicular region",
              "effects": {
                "rule_out": [],
                "increase_likelihood": [],
                "decrease_likelihood": [],
                "next_questions": [],
                "red_flag": false,
                "red_flag_text": null,
                "notes": null
              }
            }
          ],
          "source_line": 4,
          "inputType": "select"
        },
        {
          "id": "shoulder_q2",
          "question": "Do you have a recent history of fall or trauma in the affected region?",
          "category": "location",
          "answers": [
            {
              "value": "Yes",
              "effects": {
                "rule_out": [],
                "increase_likelihood": [],
                "decrease_likelihood": [],
                "next_questions": [],
                "red_flag": false,
                "red_flag_text": null,
                "notes": null
              }
            },
            {
              "value": "No",
              "effects": {
                "rule_out": [],
                "increase_likelihood": [],
                "decrease_likelihood": [],
                "next_questions": [],
                "red_flag": false,
                "red_flag_text": null,
                "notes": null
              }
            }
          ],
          "source_line": 7,
          "inputType": "select"
        },
        {
          "id": "shoulder_q3",
          "question": "How did the pain begin?",
          "category": "onset",
          "answers": [
            {
              "value": "Sudden",
              "effects": {
                "rule_out": [],
                "increase_likelihood": [],
                "decrease_likelihood": [],
                "next_questions": [],
                "red_flag": false,
                "red_flag_text": null,
                "notes": null
              }
            },
            {
              "value": "Gradual",
              "effects": {
                "rule_out": [],
                "increase_likelihood": [],
                "decrease_likelihood": [],
                "next_questions": [],
                "red_flag": false,
                "red_flag_text": null,
                "notes": null
              }
            }
          ],
          "source_line": 12,
          "inputType": "select"
        },
        {
          "id": "shoulder_q4",
          "question": "Do you experience tingling or abnormal sensations?",
          "category": "neurological",
          "answers": [
            {
              "value": "Yes",
              "effects": {
                "rule_out": [
                  "nerve involvement"
                ],
                "increase_likelihood": [],
                "decrease_likelihood": [],
                "next_questions": [],
                "red_flag": false,
                "red_flag_text": null,
                "notes": null
              }
            },
            {
              "value": "No",
              "effects": {
                "rule_out": [],
                "increase_likelihood": [],
                "decrease_likelihood": [],
                "next_questions": [],
                "red_flag": false,
                "red_flag_text": null,
                "notes": null
              }
            }
          ],
          "source_line": 15,
          "inputType": "select"
        },
        {
          "id": "shoulder_q5",
          "question": "Do you have swelling in the area of complaint?",
          "category": "inflammation",
          "answers": [
            {
              "value": "Yes",
              "effects": {
                "rule_out": [],
                "increase_likelihood": [],
                "decrease_likelihood": [],
                "next_questions": [],
                "red_flag": false,
                "red_flag_text": null,
                "notes": null
              }
            },
            {
              "value": "No",
              "effects": {
                "rule_out": [],
                "increase_likelihood": [],
                "decrease_likelihood": [],
                "next_questions": [],
                "red_flag": false,
                "red_flag_text": null,
                "notes": null
              }
            }
          ],
          "source_line": 18,
          "inputType": "select"
        },
        {
          "id": "shoulder_q6",
          "question": "Did you notice any unusual movement in the area of complaint?",
          "category": "general",
          "answers": [
            {
              "value": "Yes",
              "effects": {
                "rule_out": [],
                "increase_likelihood": [],
                "decrease_likelihood": [],
                "next_questions": [],
                "red_flag": false,
                "red_flag_text": null,
                "notes": null
              }
            },
            {
              "value": "No",
              "effects": {
                "rule_out": [],
                "increase_likelihood": [],
                "decrease_likelihood": [],
                "next_questions": [],
                "red_flag": false,
                "red_flag_text": null,
                "notes": null
              }
            }
          ],
          "source_line": 21,
          "inputType": "select"
        },
        {
          "id": "shoulder_q7",
          "question": "What aggravates this pain?",
          "category": "general",
          "answers": [
            {
              "value": "Overhead movement",
              "effects": {
                "rule_out": [],
                "increase_likelihood": [],
                "decrease_likelihood": [],
                "next_questions": [],
                "red_flag": false,
                "red_flag_text": null,
                "notes": null
              }
            },
            {
              "value": "Elevation above shoulder height",
              "effects": {
                "rule_out": [],
                "increase_likelihood": [],
                "decrease_likelihood": [],
                "next_questions": [],
                "red_flag": false,
                "red_flag_text": null,
                "notes": null
              }
            },
            {
              "value": "ABducion of the shoulder",
              "effects": {
                "rule_out": [],
                "increase_likelihood": [],
                "decrease_likelihood": [],
                "next_questions": [],
                "red_flag": false,
                "red_flag_text": null,
                "notes": null
              }
            }
          ],
          "source_line": 24,
          "inputType": "select"
        },
        {
          "id": "shoulder_q8",
          "question": "Do you feel pain when you try to raise your arm?",
          "category": "temporal",
          "answers": [
            {
              "value": "Yes",
              "effects": {
                "rule_out": [],
                "increase_likelihood": [],
                "decrease_likelihood": [],
                "next_questions": [],
                "red_flag": false,
                "red_flag_text": null,
                "notes": null
              }
            },
            {
              "value": "No",
              "effects": {
                "rule_out": [],
                "increase_likelihood": [],
                "decrease_likelihood": [],
                "next_questions": [],
                "red_flag": false,
                "red_flag_text": null,
                "notes": null
              }
            }
          ],
          "source_line": 28,
          "inputType": "select"
        },
        {
          "id": "shoulder_q9",
          "question": "Is there tenderness around the shoulder region or on palpating root of the neck?",
          "category": "location",
          "answers": [
            {
              "value": "Yes",
              "effects": {
                "rule_out": [],
                "increase_likelihood": [],
                "decrease_likelihood": [],
                "next_questions": [],
                "red_flag": false,
                "red_flag_text": null,
                "notes": null
              }
            },
            {
              "value": "No",
              "effects": {
                "rule_out": [],
                "increase_likelihood": [],
                "decrease_likelihood": [],
                "next_questions": [],
                "red_flag": false,
                "red_flag_text": null,
                "notes": null
              }
            }
          ],
          "source_line": 31,
          "inputType": "select"
        },
        {
          "id": "shoulder_q10",
          "question": "Is your sleep affected by pain?",
          "category": "general",
          "answers": [
            {
              "value": "Yes",
              "effects": {
                "rule_out": [],
                "increase_likelihood": [],
                "decrease_likelihood": [],
                "next_questions": [],
                "red_flag": false,
                "red_flag_text": null,
                "notes": null
              }
            },
            {
              "value": "No",
              "effects": {
                "rule_out": [],
                "increase_likelihood": [],
                "decrease_likelihood": [],
                "next_questions": [],
                "red_flag": false,
                "red_flag_text": null,
                "notes": null
              }
            },
            {
              "value": "Objective",
              "effects": {
                "rule_out": [],
                "increase_likelihood": [],
                "decrease_likelihood": [],
                "next_questions": [],
                "red_flag": false,
                "red_flag_text": null,
                "notes": null
              }
            }
          ],
          "source_line": 34,
          "inputType": "select"
        },
        {
          "id": "shoulder_q11",
          "question": "Is shoulder alignment proper?",
          "category": "general",
          "answers": [
            {
              "value": "If sagging",
              "effects": {
                "rule_out": [],
                "increase_likelihood": [],
                "decrease_likelihood": [],
                "next_questions": [],
                "red_flag": false,
                "red_flag_text": null,
                "notes": "clavicular #"
              }
            }
          ],
          "source_line": 39,
          "inputType": "select"
        },
        {
          "id": "shoulder_q12",
          "question": "Is bruising and swelling present?",
          "category": "inflammation",
          "answers": [
            {
              "value": "Yes",
              "effects": {
                "rule_out": [],
                "increase_likelihood": [],
                "decrease_likelihood": [],
                "next_questions": [],
                "red_flag": false,
                "red_flag_text": null,
                "notes": null
              }
            },
            {
              "value": "No",
              "effects": {
                "rule_out": [],
                "increase_likelihood": [],
                "decrease_likelihood": [],
                "next_questions": [],
                "red_flag": false,
                "red_flag_text": null,
                "notes": null
              }
            }
          ],
          "source_line": 41,
          "inputType": "select"
        },
        {
          "id": "shoulder_q13",
          "question": "Is patient adopting a pain avoidance posture by clasping hands together?",
          "category": "general",
          "answers": [
            {
              "value": "Yes",
              "effects": {
                "rule_out": [],
                "increase_likelihood": [],
                "decrease_likelihood": [],
                "next_questions": [],
                "red_flag": false,
                "red_flag_text": null,
                "notes": null
              }
            },
            {
              "value": "No",
              "effects": {
                "rule_out": [],
                "increase_likelihood": [],
                "decrease_likelihood": [],
                "next_questions": [],
                "red_flag": false,
                "red_flag_text": null,
                "notes": null
              }
            }
          ],
          "source_line": 44,
          "inputType": "select"
        },
        {
          "id": "shoulder_q14",
          "question": "Is there a bump or obvious deformity around the clavicle?",
          "category": "general",
          "answers": [
            {
              "value": "Yes",
              "effects": {
                "rule_out": [],
                "increase_likelihood": [],
                "decrease_likelihood": [],
                "next_questions": [],
                "red_flag": false,
                "red_flag_text": null,
                "notes": null
              }
            },
            {
              "value": "No",
              "effects": {
                "rule_out": [],
                "increase_likelihood": [],
                "decrease_likelihood": [],
                "next_questions": [],
                "red_flag": false,
                "red_flag_text": null,
                "notes": null
              }
            }
          ],
          "source_line": 47,
          "inputType": "select"
        }
      ],
      "recommended_tests": [],
      "confirmation_methods": [],
      "observations": [],
      "is_general": true
    },
    {
      "name": "Shoulder Impingement Syndrome",
      "entry_criteria": [],
      "questions": [
        {
          "id": "shoulder_q15",
          "question": "What region is pain present in?",
          "category": "location",
          "answers": [
            {
              "value": "Neck",
              "effects": {
                "rule_out": [],
                "increase_likelihood": [],
                "decrease_likelihood": [],
                "next_questions": [],
                "red_flag": false,
                "red_flag_text": null,
                "notes": null
              }
            },
            {
              "value": "Neck and shoulder region",
              "effects": {
                "rule_out": [],
                "increase_likelihood": [],
                "decrease_likelihood": [],
                "next_questions": [],
                "red_flag": false,
                "red_flag_text": null,
                "notes": null
              }
            },
            {
              "value": "Shoulder",
              "effects": {
                "rule_out": [],
                "increase_likelihood": [],
                "decrease_likelihood": [],
                "next_questions": [],
                "red_flag": false,
                "red_flag_text": null,
                "notes": null
              }
            }
          ],
          "source_line": 56,
          "inputType": "select"
        },
        {
          "id": "shoulder_q16",
          "question": "Do you experience tingling or abnormal sensations? –",
          "category": "neurological",
          "answers": [
            {
              "value": "Yes",
              "effects": {
                "rule_out": [],
                "increase_likelihood": [
                  "ation,"
                ],
                "decrease_likelihood": [],
                "next_questions": [],
                "red_flag": false,
                "red_flag_text": null,
                "notes": null
              }
            },
            {
              "value": "No",
              "effects": {
                "rule_out": [],
                "increase_likelihood": [],
                "decrease_likelihood": [],
                "next_questions": [],
                "red_flag": false,
                "red_flag_text": null,
                "notes": null
              }
            }
          ],
          "source_line": 60,
          "inputType": "select"
        },
        {
          "id": "shoulder_q17",
          "question": "What is the nature of the pain you experience?",
          "category": "general",
          "answers": [
            {
              "value": "Sharp or pinching",
              "effects": {
                "rule_out": [],
                "increase_likelihood": [],
                "decrease_likelihood": [],
                "next_questions": [],
                "red_flag": false,
                "red_flag_text": null,
                "notes": null
              }
            },
            {
              "value": "Dull and aching",
              "effects": {
                "rule_out": [],
                "increase_likelihood": [],
                "decrease_likelihood": [],
                "next_questions": [],
                "red_flag": false,
                "red_flag_text": null,
                "notes": null
              }
            }
          ],
          "source_line": 63,
          "inputType": "select"
        },
        {
          "id": "shoulder_q18",
          "question": "How did the pain begin?",
          "category": "onset",
          "answers": [
            {
              "value": "Sudden",
              "effects": {
                "rule_out": [],
                "increase_likelihood": [],
                "decrease_likelihood": [],
                "next_questions": [],
                "red_flag": false,
                "red_flag_text": null,
                "notes": null
              }
            },
            {
              "value": "Gradual",
              "effects": {
                "rule_out": [],
                "increase_likelihood": [],
                "decrease_likelihood": [],
                "next_questions": [],
                "red_flag": false,
                "red_flag_text": null,
                "notes": null
              }
            },
            {
              "value": "Yes",
              "effects": {
                "rule_out": [],
                "increase_likelihood": [],
                "decrease_likelihood": [],
                "next_questions": [],
                "red_flag": false,
                "red_flag_text": null,
                "notes": null
              }
            },
            {
              "value": "No",
              "effects": {
                "rule_out": [],
                "increase_likelihood": [],
                "decrease_likelihood": [],
                "next_questions": [],
                "red_flag": false,
                "red_flag_text": null,
                "notes": null
              }
            }
          ],
          "source_line": 66,
          "inputType": "select"
        },
        {
          "id": "shoulder_q19",
          "question": "What currently aggravates the pain?",
          "category": "general",
          "answers": [
            {
              "value": "Arm flexion",
              "effects": {
                "rule_out": [],
                "increase_likelihood": [],
                "decrease_likelihood": [],
                "next_questions": [],
                "red_flag": false,
                "red_flag_text": null,
                "notes": "Movement of the arm forward"
              }
            },
            {
              "value": "Internal rotation",
              "effects": {
                "rule_out": [],
                "increase_likelihood": [],
                "decrease_likelihood": [],
                "next_questions": [],
                "red_flag": false,
                "red_flag_text": null,
                "notes": "Rotating the arm inward"
              }
            },
            {
              "value": "Abduction",
              "effects": {
                "rule_out": [],
                "increase_likelihood": [],
                "decrease_likelihood": [],
                "next_questions": [],
                "red_flag": false,
                "red_flag_text": null,
                "notes": null
              }
            },
            {
              "value": "Sleeping on the affected side",
              "effects": {
                "rule_out": [],
                "increase_likelihood": [],
                "decrease_likelihood": [],
                "next_questions": [],
                "red_flag": false,
                "red_flag_text": null,
                "notes": null
              }
            }
          ],
          "source_line": 72,
          "inputType": "select"
        },
        {
          "id": "shoulder_q20",
          "question": "If Pain is felt on Abduction and internal rotation, is pain present in the front or lateral part of the shoulder?",
          "category": "general",
          "answers": [
            {
              "value": "Yes",
              "effects": {
                "rule_out": [],
                "increase_likelihood": [],
                "decrease_likelihood": [],
                "next_questions": [],
                "red_flag": false,
                "red_flag_text": null,
                "notes": null
              }
            },
            {
              "value": "No",
              "effects": {
                "rule_out": [],
                "increase_likelihood": [],
                "decrease_likelihood": [],
                "next_questions": [],
                "red_flag": false,
                "red_flag_text": null,
                "notes": null
              }
            }
          ],
          "source_line": 77,
          "inputType": "select"
        },
        {
          "id": "shoulder_q21",
          "question": "Does your job or daily tasks involve repetitive shoulder movement?",
          "category": "general",
          "answers": [
            {
              "value": "Yes",
              "effects": {
                "rule_out": [],
                "increase_likelihood": [],
                "decrease_likelihood": [],
                "next_questions": [],
                "red_flag": false,
                "red_flag_text": null,
                "notes": null
              }
            },
            {
              "value": "no",
              "effects": {
                "rule_out": [],
                "increase_likelihood": [],
                "decrease_likelihood": [],
                "next_questions": [],
                "red_flag": false,
                "red_flag_text": null,
                "notes": null
              }
            }
          ],
          "source_line": 80,
          "inputType": "select"
        },
        {
          "id": "shoulder_q22",
          "question": "On what movement is the pain felt?",
          "category": "general",
          "answers": [
            {
              "value": "Active",
              "effects": {
                "rule_out": [],
                "increase_likelihood": [],
                "decrease_likelihood": [],
                "next_questions": [],
                "red_flag": false,
                "red_flag_text": null,
                "notes": null
              }
            },
            {
              "value": "Passive",
              "effects": {
                "rule_out": [],
                "increase_likelihood": [],
                "decrease_likelihood": [],
                "next_questions": [],
                "red_flag": false,
                "red_flag_text": null,
                "notes": "Bursitis"
              }
            },
            {
              "value": "Both",
              "effects": {
                "rule_out": [],
                "increase_likelihood": [],
                "decrease_likelihood": [],
                "next_questions": [],
                "red_flag": false,
                "red_flag_text": null,
                "notes": null
              }
            }
          ],
          "source_line": 83,
          "inputType": "select"
        },
        {
          "id": "shoulder_q23",
          "question": "Do you experience weakness on moving your shoulder?",
          "category": "neurological",
          "answers": [
            {
              "value": "Yes",
              "effects": {
                "rule_out": [],
                "increase_likelihood": [],
                "decrease_likelihood": [],
                "next_questions": [],
                "red_flag": false,
                "red_flag_text": null,
                "notes": null
              }
            },
            {
              "value": "No",
              "effects": {
                "rule_out": [],
                "increase_likelihood": [],
                "decrease_likelihood": [],
                "next_questions": [],
                "red_flag": false,
                "red_flag_text": null,
                "notes": null
              }
            }
          ],
          "source_line": 87,
          "inputType": "select"
        }
      ],
      "recommended_tests": [],
      "confirmation_methods": [],
      "observations": [],
      "source_line": 55
    },
    {
      "name": "Subacute tendinitis OR Painfularc syndrome",
      "entry_criteria": [],
      "questions": [
        {
          "id": "shoulder_q24",
          "question": "Does the pain resolve significantly after the precipitating activity is avoided?",
          "category": "activity",
          "answers": [
            {
              "value": "Yes",
              "effects": {
                "rule_out": [],
                "increase_likelihood": [],
                "decrease_likelihood": [],
                "next_questions": [],
                "red_flag": false,
                "red_flag_text": null,
                "notes": null
              }
            },
            {
              "value": "No",
              "effects": {
                "rule_out": [],
                "increase_likelihood": [],
                "decrease_likelihood": [],
                "next_questions": [],
                "red_flag": false,
                "red_flag_text": null,
                "notes": null
              }
            }
          ],
          "source_line": 95,
          "inputType": "select"
        },
        {
          "id": "shoulder_q25",
          "question": "Palpate the anterior edge of the acromion with the arm in extension and flexion. (Subacute Tendinitis). Is pain present?",
          "category": "general",
          "answers": [
            {
              "value": "Yes",
              "effects": {
                "rule_out": [],
                "increase_likelihood": [],
                "decrease_likelihood": [],
                "next_questions": [],
                "red_flag": false,
                "red_flag_text": null,
                "notes": null
              }
            },
            {
              "value": "No",
              "effects": {
                "rule_out": [],
                "increase_likelihood": [],
                "decrease_likelihood": [],
                "next_questions": [],
                "red_flag": false,
                "red_flag_text": null,
                "notes": null
              }
            }
          ],
          "source_line": 98,
          "inputType": "select"
        }
      ],
      "recommended_tests": [],
      "confirmation_methods": [],
      "observations": [],
      "source_line": 90
    },
    {
      "name": "Chronic Tendinitis",
      "entry_criteria": [],
      "questions": [
        {
          "id": "shoulder_q26",
          "question": "Have you had a previous history of shoulder pain after repetitive use? (Link to question 11, maybe redundant)",
          "category": "history",
          "answers": [
            {
              "value": "Yes",
              "effects": {
                "rule_out": [],
                "increase_likelihood": [],
                "decrease_likelihood": [],
                "next_questions": [],
                "red_flag": false,
                "red_flag_text": null,
                "notes": null
              }
            },
            {
              "value": "No",
              "effects": {
                "rule_out": [],
                "increase_likelihood": [],
                "decrease_likelihood": [],
                "next_questions": [],
                "red_flag": false,
                "red_flag_text": null,
                "notes": null
              }
            }
          ],
          "source_line": 102,
          "inputType": "select"
        },
        {
          "id": "shoulder_q27",
          "question": "Does pain reduce with rest OR anti-inflammatory use?",
          "category": "general",
          "answers": [
            {
              "value": "Yes",
              "effects": {
                "rule_out": [],
                "increase_likelihood": [],
                "decrease_likelihood": [],
                "next_questions": [],
                "red_flag": false,
                "red_flag_text": null,
                "notes": null
              }
            },
            {
              "value": "No",
              "effects": {
                "rule_out": [],
                "increase_likelihood": [],
                "decrease_likelihood": [],
                "next_questions": [],
                "red_flag": false,
                "red_flag_text": null,
                "notes": null
              }
            }
          ],
          "source_line": 105,
          "inputType": "select"
        },
        {
          "id": "shoulder_q28",
          "question": "Is there tenderness along the bicipital groove or on moving the biceps tendon?",
          "category": "general",
          "answers": [
            {
              "value": "Yes",
              "effects": {
                "rule_out": [],
                "increase_likelihood": [],
                "decrease_likelihood": [],
                "next_questions": [],
                "red_flag": false,
                "red_flag_text": null,
                "notes": "Biccipital tendinitis can co-exist with other rotator cuff pathologies"
              }
            },
            {
              "value": "No",
              "effects": {
                "rule_out": [],
                "increase_likelihood": [],
                "decrease_likelihood": [],
                "next_questions": [],
                "red_flag": false,
                "red_flag_text": null,
                "notes": null
              }
            }
          ],
          "source_line": 108,
          "inputType": "select"
        }
      ],
      "recommended_tests": [],
      "confirmation_methods": [],
      "observations": [],
      "source_line": 101
    },
    {
      "name": "Cuff Disruption",
      "entry_criteria": [],
      "questions": [
        {
          "id": "shoulder_q29",
          "question": "Are you above 45yrs of age?",
          "category": "demographic",
          "answers": [
            {
              "value": "Yes",
              "effects": {
                "rule_out": [],
                "increase_likelihood": [],
                "decrease_likelihood": [],
                "next_questions": [],
                "red_flag": false,
                "red_flag_text": null,
                "notes": null
              }
            },
            {
              "value": "No",
              "effects": {
                "rule_out": [],
                "increase_likelihood": [],
                "decrease_likelihood": [],
                "next_questions": [],
                "red_flag": false,
                "red_flag_text": null,
                "notes": null
              }
            }
          ],
          "source_line": 112,
          "inputType": "select"
        },
        {
          "id": "shoulder_q30",
          "question": "Do you have a previous history of sprain or a jerking movement at the shoulder?",
          "category": "history",
          "answers": [
            {
              "value": "Yes",
              "effects": {
                "rule_out": [],
                "increase_likelihood": [],
                "decrease_likelihood": [],
                "next_questions": [],
                "red_flag": false,
                "red_flag_text": null,
                "notes": null
              }
            },
            {
              "value": "No",
              "effects": {
                "rule_out": [],
                "increase_likelihood": [],
                "decrease_likelihood": [],
                "next_questions": [],
                "red_flag": false,
                "red_flag_text": null,
                "notes": null
              }
            },
            {
              "value": "Check if the patient can complete a full abduction of the arm.",
              "effects": {
                "rule_out": [],
                "increase_likelihood": [],
                "decrease_likelihood": [],
                "next_questions": [],
                "red_flag": false,
                "red_flag_text": null,
                "notes": null
              }
            },
            {
              "value": "If pt, cannot initiate arm ABduction – full tear",
              "effects": {
                "rule_out": [],
                "increase_likelihood": [],
                "decrease_likelihood": [],
                "next_questions": [],
                "red_flag": false,
                "red_flag_text": null,
                "notes": null
              }
            },
            {
              "value": "If active ABduction is possible – partial tear.",
              "effects": {
                "rule_out": [],
                "increase_likelihood": [],
                "decrease_likelihood": [],
                "next_questions": [],
                "red_flag": false,
                "red_flag_text": null,
                "notes": null
              }
            },
            {
              "value": "SPECIAL CONFIRMATORY TESTS",
              "effects": {
                "rule_out": [],
                "increase_likelihood": [],
                "decrease_likelihood": [],
                "next_questions": [],
                "red_flag": false,
                "red_flag_text": null,
                "notes": null
              }
            },
            {
              "value": "Spurling’s Test",
              "effects": {
                "rule_out": [],
                "increase_likelihood": [],
                "decrease_likelihood": [],
                "next_questions": [],
                "red_flag": false,
                "red_flag_text": null,
                "notes": null
              }
            },
            {
              "value": "Scapular rhythm is disturbed",
              "effects": {
                "rule_out": [],
                "increase_likelihood": [],
                "decrease_likelihood": [],
                "next_questions": [],
                "red_flag": false,
                "red_flag_text": null,
                "notes": null
              }
            },
            {
              "value": "Pain is aggraavated between the range of 60 - 120 deg",
              "effects": {
                "rule_out": [],
                "increase_likelihood": [],
                "decrease_likelihood": [],
                "next_questions": [],
                "red_flag": false,
                "red_flag_text": null,
                "notes": null
              }
            },
            {
              "value": "Pain is alleviated IF shoulder is laterally rotated on ABduction",
              "effects": {
                "rule_out": [],
                "increase_likelihood": [],
                "decrease_likelihood": [],
                "next_questions": [],
                "red_flag": false,
                "red_flag_text": null,
                "notes": null
              }
            },
            {
              "value": "If positive, SIS is indicated",
              "effects": {
                "rule_out": [],
                "increase_likelihood": [],
                "decrease_likelihood": [],
                "next_questions": [],
                "red_flag": false,
                "red_flag_text": null,
                "notes": null
              }
            },
            {
              "value": "Positive sign, Affected side is weaker than the unaffected side.",
              "effects": {
                "rule_out": [],
                "increase_likelihood": [],
                "decrease_likelihood": [],
                "next_questions": [],
                "red_flag": false,
                "red_flag_text": null,
                "notes": null
              }
            },
            {
              "value": "Positive sign suggests tear in the supraspinatus",
              "effects": {
                "rule_out": [],
                "increase_likelihood": [],
                "decrease_likelihood": [],
                "next_questions": [],
                "red_flag": false,
                "red_flag_text": null,
                "notes": null
              }
            },
            {
              "value": "Lack of power on one side indicates weakness of the infraspinatus muscle",
              "effects": {
                "rule_out": [],
                "increase_likelihood": [],
                "decrease_likelihood": [],
                "next_questions": [],
                "red_flag": false,
                "red_flag_text": null,
                "notes": null
              }
            },
            {
              "value": "If test is done with arm in 90 deg elevation",
              "effects": {
                "rule_out": [],
                "increase_likelihood": [],
                "decrease_likelihood": [],
                "next_questions": [],
                "red_flag": false,
                "red_flag_text": null,
                "notes": null
              }
            }
          ],
          "source_line": 115,
          "inputType": "select"
        }
      ],
      "recommended_tests": [],
      "confirmation_methods": [],
      "observations": [],
      "source_line": 111
    },
    {
      "name": "CALCIFIC TENDINITIS",
      "entry_criteria": [],
      "questions": [
        {
          "id": "shoulder_q31",
          "question": "What is the pain type?",
          "category": "general",
          "answers": [
            {
              "value": "Sharp or pinching",
              "effects": {
                "rule_out": [],
                "increase_likelihood": [],
                "decrease_likelihood": [],
                "next_questions": [],
                "red_flag": false,
                "red_flag_text": null,
                "notes": null
              }
            },
            {
              "value": "Dull and aching",
              "effects": {
                "rule_out": [],
                "increase_likelihood": [],
                "decrease_likelihood": [],
                "next_questions": [],
                "red_flag": false,
                "red_flag_text": null,
                "notes": null
              }
            }
          ],
          "source_line": 159,
          "inputType": "select"
        },
        {
          "id": "shoulder_q32",
          "question": "How did the pain begin?",
          "category": "onset",
          "answers": [
            {
              "value": "Sudden",
              "effects": {
                "rule_out": [],
                "increase_likelihood": [],
                "decrease_likelihood": [],
                "next_questions": [],
                "red_flag": false,
                "red_flag_text": null,
                "notes": null
              }
            },
            {
              "value": "Gradual",
              "effects": {
                "rule_out": [],
                "increase_likelihood": [],
                "decrease_likelihood": [],
                "next_questions": [],
                "red_flag": false,
                "red_flag_text": null,
                "notes": null
              }
            }
          ],
          "source_line": 162,
          "inputType": "select"
        },
        {
          "id": "shoulder_q33",
          "question": "Did the pain increase drastically within a few hours?",
          "category": "general",
          "answers": [
            {
              "value": "Yes",
              "effects": {
                "rule_out": [],
                "increase_likelihood": [],
                "decrease_likelihood": [],
                "next_questions": [],
                "red_flag": false,
                "red_flag_text": null,
                "notes": null
              }
            },
            {
              "value": "No",
              "effects": {
                "rule_out": [],
                "increase_likelihood": [],
                "decrease_likelihood": [],
                "next_questions": [],
                "red_flag": false,
                "red_flag_text": null,
                "notes": null
              }
            },
            {
              "value": "Do you experience pain more at night",
              "effects": {
                "rule_out": [],
                "increase_likelihood": [],
                "decrease_likelihood": [],
                "next_questions": [],
                "red_flag": false,
                "red_flag_text": null,
                "notes": null
              }
            },
            {
              "value": "Yes",
              "effects": {
                "rule_out": [],
                "increase_likelihood": [],
                "decrease_likelihood": [],
                "next_questions": [],
                "red_flag": false,
                "red_flag_text": null,
                "notes": null
              }
            },
            {
              "value": "No",
              "effects": {
                "rule_out": [],
                "increase_likelihood": [],
                "decrease_likelihood": [],
                "next_questions": [],
                "red_flag": false,
                "red_flag_text": null,
                "notes": null
              }
            }
          ],
          "source_line": 165,
          "inputType": "select"
        },
        {
          "id": "shoulder_q34",
          "question": "Can you perform the movements around the shoulder joint?",
          "category": "general",
          "answers": [
            {
              "value": "Yes",
              "effects": {
                "rule_out": [],
                "increase_likelihood": [],
                "decrease_likelihood": [],
                "next_questions": [],
                "red_flag": false,
                "red_flag_text": null,
                "notes": null
              }
            },
            {
              "value": "No",
              "effects": {
                "rule_out": [],
                "increase_likelihood": [],
                "decrease_likelihood": [],
                "next_questions": [],
                "red_flag": false,
                "red_flag_text": null,
                "notes": null
              }
            }
          ],
          "source_line": 171,
          "inputType": "select"
        },
        {
          "id": "shoulder_q35",
          "question": "Does the pain subside after a few days and the shoulder is restored to normal functioning?",
          "category": "general",
          "answers": [
            {
              "value": "If Yes",
              "effects": {
                "rule_out": [],
                "increase_likelihood": [],
                "decrease_likelihood": [],
                "next_questions": [],
                "red_flag": false,
                "red_flag_text": null,
                "notes": "Acute Calcific Tendinitis"
              }
            }
          ],
          "source_line": 174,
          "inputType": "select"
        }
      ],
      "recommended_tests": [
        "Check X-ray to rule asymptomatic calcification",
        "Lesions of the Biceps Tendon (Confirmation)",
        "Biccipital Tendinitis as above:",
        "Special Test for Biccipital Tendinitis",
        "Speed Test: Place pt’s arm in shoulder flexion, forearm supination and elbow extension. The examiner then applies pressure to the arm as downward action.",
        "A positive sign, pain in the bicipital grove is replicable",
        "Yergasom’s test:  Pt places the forearm in the supine position, and the examiner applies resistance against supination.",
        "A positive sign, this replicates the pain in the bicipital group tenderness.",
        "Rupture of the Biceps Tendon (Confirmation)",
        "Age (over 50yrs)",
        "Ask pt to lift or offer resistance to biceps contraction",
        "Is a prominent lump is seen in lower arm",
        "The upper arm becomes painful and bruised",
        "Hypertrophy and intra-articular entrapment (the hourglass biceps) -(Confirmation)",
        "Ask patient to elevate the shoulder",
        "Is buckling of tendon present?",
        "Do you feel pain on shoulder elevation?",
        "Can the patient elevate the arm up till the end of the range?",
        "SLAP LESION (Confirmation)",
        "Did you have any history of fall or trauma with hand stretched out?",
        "Did you have any history of loading the shoulder region with weight?",
        "Do you feel a ‘painful click’ when you lift your arm above shoulder height?",
        "Do you feel weakness in your arm when doing activities above shoulder height?",
        "Ask the patient to throw to reach a far distance where above shoulder movement is indicated.",
        "Patient is unable to",
        "Patient is able to",
        "Patient is able to (with pain involvement)",
        "Special Test for SLAP (O’Brien’s test)",
        "Instruct the patient to flex the arm up to 90 deg with the elbow in full extension.Then ask pt to adduct arm 10-15 deg medial to sagittal plane. Arm is maximally internally rotated and examiner applies downward pressure while patient is asked to resist.  Procedure is then repeated in supination",
        "Positive: Pain is elicited by the first manoeuvre, and is reduced or eliminated by the second.",
        "ADHESIVE CAPSULITIS (Frozen Shoulder Syndrome)",
        "Age (40-60)",
        "At the early phase of this pain, did you find it difficult to turn your shoulder out (External rotation) and/or take your arm away from your body (abduction)?",
        "Yes \t(Check for adhesive capsulitis– early phase. Carry out active and passive movements)",
        "Currently, do you find it difficult to turn your shoulder in (Internal rotation) or move your arms towards your body/chest (Adduction)",
        "Yes\t(Check for adhesive capsulitis – freezing phase)",
        "Do you find it easier to move your shoulder backwards (extension)?",
        "Do you experience progressive stiffness in your shoulder?",
        "Is the pain worse at night?",
        "Have you had any of the following conditions before: Diabetes, Dupuytren’s, hyperlipidemia, hyperthyroidism, cardiac disease, hemiplegia?",
        "Have you undergone a neurosurgical procedure before?",
        "Previous history of fall or trauma to affected side?",
        "Yes \t(Traumatic Adhesive Capsulitis)",
        "No\t(Non-traumatic Adhesive Capsulitis)",
        "Test for Adhesive Capsulitis",
        "Check if the Active range of motion and passive range of motion is full across shoulder joints",
        "Active and Passive range of motion is limited in Adhesive Capsulitis",
        "Rule out other causes of stiffness with imaging"
      ],
      "confirmation_methods": [],
      "observations": [],
      "source_line": 155
    },
    {
      "name": "RECURRENT SHOULDER SUBLUXATION",
      "entry_criteria": [
        {
          "type": "age",
          "description": "Age (Young adult: 18-25)"
        }
      ],
      "questions": [
        {
          "id": "shoulder_q36",
          "question": "Have you had a previous history of a shoulder dislocation?",
          "category": "location",
          "answers": [
            {
              "value": "Yes",
              "effects": {
                "rule_out": [],
                "increase_likelihood": [],
                "decrease_likelihood": [],
                "next_questions": [],
                "red_flag": false,
                "red_flag_text": null,
                "notes": null
              }
            },
            {
              "value": "No",
              "effects": {
                "rule_out": [],
                "increase_likelihood": [],
                "decrease_likelihood": [],
                "next_questions": [],
                "red_flag": false,
                "red_flag_text": null,
                "notes": null
              }
            }
          ],
          "source_line": 257,
          "inputType": "select"
        },
        {
          "id": "shoulder_q37",
          "question": "Did the first episode occur with a pull on an abducted, laterally rotated-extended arm?",
          "category": "general",
          "answers": [
            {
              "value": "Yes",
              "effects": {
                "rule_out": [],
                "increase_likelihood": [],
                "decrease_likelihood": [],
                "next_questions": [],
                "red_flag": false,
                "red_flag_text": null,
                "notes": null
              }
            },
            {
              "value": "No",
              "effects": {
                "rule_out": [],
                "increase_likelihood": [],
                "decrease_likelihood": [],
                "next_questions": [],
                "red_flag": false,
                "red_flag_text": null,
                "notes": null
              }
            }
          ],
          "source_line": 260,
          "inputType": "select"
        },
        {
          "id": "shoulder_q38",
          "question": "Do you experience a catching sensation followed by numbness or weakness (Dead-arm syndrome) when making overhead arm movements?",
          "category": "temporal",
          "answers": [
            {
              "value": "Yes",
              "effects": {
                "rule_out": [
                  "rotator cuff disorder and cervical radiculitis"
                ],
                "increase_likelihood": [],
                "decrease_likelihood": [],
                "next_questions": [],
                "red_flag": false,
                "red_flag_text": null,
                "notes": null
              }
            },
            {
              "value": "No",
              "effects": {
                "rule_out": [],
                "increase_likelihood": [],
                "decrease_likelihood": [],
                "next_questions": [],
                "red_flag": false,
                "red_flag_text": null,
                "notes": null
              }
            },
            {
              "value": "Special Tests for Recurrent Subluxation",
              "effects": {
                "rule_out": [],
                "increase_likelihood": [],
                "decrease_likelihood": [],
                "next_questions": [],
                "red_flag": false,
                "red_flag_text": null,
                "notes": null
              }
            },
            {
              "value": "Apprehension Test:",
              "effects": {
                "rule_out": [],
                "increase_likelihood": [],
                "decrease_likelihood": [],
                "next_questions": [],
                "red_flag": false,
                "red_flag_text": null,
                "notes": null
              }
            },
            {
              "value": "Fulcrum’s Test:",
              "effects": {
                "rule_out": [],
                "increase_likelihood": [],
                "decrease_likelihood": [],
                "next_questions": [],
                "red_flag": false,
                "red_flag_text": null,
                "notes": null
              }
            },
            {
              "value": "Drawer’s Test:",
              "effects": {
                "rule_out": [],
                "increase_likelihood": [],
                "decrease_likelihood": [],
                "next_questions": [],
                "red_flag": false,
                "red_flag_text": null,
                "notes": null
              }
            }
          ],
          "source_line": 263,
          "inputType": "select"
        }
      ],
      "recommended_tests": [],
      "confirmation_methods": [],
      "observations": [],
      "source_line": 255
    },
    {
      "name": "RHEUMATOID ARTHRITIS",
      "entry_criteria": [],
      "questions": [
        {
          "id": "shoulder_q39",
          "question": "Do you have a history of generalised Rheumatoid Arthritis?",
          "category": "history",
          "answers": [
            {
              "value": "Yes",
              "effects": {
                "rule_out": [],
                "increase_likelihood": [],
                "decrease_likelihood": [],
                "next_questions": [],
                "red_flag": false,
                "red_flag_text": null,
                "notes": null
              }
            },
            {
              "value": "No",
              "effects": {
                "rule_out": [],
                "increase_likelihood": [],
                "decrease_likelihood": [],
                "next_questions": [],
                "red_flag": false,
                "red_flag_text": null,
                "notes": null
              }
            }
          ],
          "source_line": 277,
          "inputType": "select"
        },
        {
          "id": "shoulder_q40",
          "question": "Do you experience pain and swelling in both shoulder joints?",
          "category": "inflammation",
          "answers": [
            {
              "value": "Yes",
              "effects": {
                "rule_out": [],
                "increase_likelihood": [],
                "decrease_likelihood": [],
                "next_questions": [],
                "red_flag": false,
                "red_flag_text": null,
                "notes": null
              }
            },
            {
              "value": "No",
              "effects": {
                "rule_out": [],
                "increase_likelihood": [],
                "decrease_likelihood": [],
                "next_questions": [],
                "red_flag": false,
                "red_flag_text": null,
                "notes": null
              }
            }
          ],
          "source_line": 280,
          "inputType": "select"
        },
        {
          "id": "shoulder_q41",
          "question": "Do you smoke?",
          "category": "general",
          "answers": [
            {
              "value": "Yes",
              "effects": {
                "rule_out": [],
                "increase_likelihood": [],
                "decrease_likelihood": [],
                "next_questions": [],
                "red_flag": false,
                "red_flag_text": null,
                "notes": null
              }
            },
            {
              "value": "No",
              "effects": {
                "rule_out": [],
                "increase_likelihood": [],
                "decrease_likelihood": [],
                "next_questions": [],
                "red_flag": false,
                "red_flag_text": null,
                "notes": null
              }
            }
          ],
          "source_line": 283,
          "inputType": "select"
        },
        {
          "id": "shoulder_q42",
          "question": "Do you have episodes of fever that resolve spontaneously?",
          "category": "general",
          "answers": [
            {
              "value": "Yes",
              "effects": {
                "rule_out": [],
                "increase_likelihood": [],
                "decrease_likelihood": [],
                "next_questions": [],
                "red_flag": false,
                "red_flag_text": null,
                "notes": null
              }
            },
            {
              "value": "No",
              "effects": {
                "rule_out": [],
                "increase_likelihood": [],
                "decrease_likelihood": [],
                "next_questions": [],
                "red_flag": false,
                "red_flag_text": null,
                "notes": null
              }
            }
          ],
          "source_line": 286,
          "inputType": "select"
        },
        {
          "id": "shoulder_q43",
          "question": "Is swelling present anteriorly and superiorly to the shoulder?",
          "category": "inflammation",
          "answers": [
            {
              "value": "Yes",
              "effects": {
                "rule_out": [],
                "increase_likelihood": [],
                "decrease_likelihood": [],
                "next_questions": [],
                "red_flag": false,
                "red_flag_text": null,
                "notes": null
              }
            },
            {
              "value": "No",
              "effects": {
                "rule_out": [],
                "increase_likelihood": [],
                "decrease_likelihood": [],
                "next_questions": [],
                "red_flag": false,
                "red_flag_text": null,
                "notes": null
              }
            }
          ],
          "source_line": 289,
          "inputType": "select"
        },
        {
          "id": "shoulder_q44",
          "question": "Is swelling present in the axilla?",
          "category": "inflammation",
          "answers": [
            {
              "value": "Yes",
              "effects": {
                "rule_out": [],
                "increase_likelihood": [],
                "decrease_likelihood": [],
                "next_questions": [],
                "red_flag": false,
                "red_flag_text": null,
                "notes": null
              }
            },
            {
              "value": "No",
              "effects": {
                "rule_out": [],
                "increase_likelihood": [],
                "decrease_likelihood": [],
                "next_questions": [],
                "red_flag": false,
                "red_flag_text": null,
                "notes": null
              }
            }
          ],
          "source_line": 292,
          "inputType": "select"
        },
        {
          "id": "shoulder_q45",
          "question": "Do you experience increasing limitations in performing self-care (styling hair, dressing, shaving)?",
          "category": "general",
          "answers": [
            {
              "value": "Yes",
              "effects": {
                "rule_out": [],
                "increase_likelihood": [],
                "decrease_likelihood": [],
                "next_questions": [],
                "red_flag": false,
                "red_flag_text": null,
                "notes": null
              }
            },
            {
              "value": "No",
              "effects": {
                "rule_out": [],
                "increase_likelihood": [],
                "decrease_likelihood": [],
                "next_questions": [],
                "red_flag": false,
                "red_flag_text": null,
                "notes": null
              }
            }
          ],
          "source_line": 295,
          "inputType": "select"
        }
      ],
      "recommended_tests": [],
      "confirmation_methods": [
        "Radiographic confirmation – check for periarticular erosions, subchondral sclerosis, and resorption."
      ],
      "observations": [],
      "source_line": 274
    },
    {
      "name": "OSTEOARTHRITIS",
      "entry_criteria": [
        {
          "type": "age",
          "description": "Age (50-60 years)"
        }
      ],
      "questions": [
        {
          "id": "shoulder_q46",
          "question": "Have you had a previous history of injury, shoulder dislocation, or painful arc syndrome?",
          "category": "location",
          "answers": [
            {
              "value": "Yes",
              "effects": {
                "rule_out": [],
                "increase_likelihood": [],
                "decrease_likelihood": [],
                "next_questions": [],
                "red_flag": false,
                "red_flag_text": null,
                "notes": null
              }
            },
            {
              "value": "No",
              "effects": {
                "rule_out": [],
                "increase_likelihood": [],
                "decrease_likelihood": [],
                "next_questions": [],
                "red_flag": false,
                "red_flag_text": null,
                "notes": null
              }
            }
          ],
          "source_line": 302,
          "inputType": "select"
        },
        {
          "id": "shoulder_q47",
          "question": "Do you feel the pain more at night?",
          "category": "temporal",
          "answers": [
            {
              "value": "Yes",
              "effects": {
                "rule_out": [
                  "adhesive capsulitis"
                ],
                "increase_likelihood": [],
                "decrease_likelihood": [],
                "next_questions": [],
                "red_flag": false,
                "red_flag_text": null,
                "notes": null
              }
            },
            {
              "value": "No",
              "effects": {
                "rule_out": [],
                "increase_likelihood": [],
                "decrease_likelihood": [],
                "next_questions": [],
                "red_flag": false,
                "red_flag_text": null,
                "notes": null
              }
            }
          ],
          "source_line": 305,
          "inputType": "select"
        },
        {
          "id": "shoulder_q48",
          "question": "Is your shoulder movement restricted across ALL joint motions?",
          "category": "general",
          "answers": [
            {
              "value": "Yes",
              "effects": {
                "rule_out": [],
                "increase_likelihood": [],
                "decrease_likelihood": [],
                "next_questions": [],
                "red_flag": false,
                "red_flag_text": null,
                "notes": null
              }
            },
            {
              "value": "No",
              "effects": {
                "rule_out": [
                  "Adhesive Capsulitis. Extension is free in Adhesive Capsulitis"
                ],
                "increase_likelihood": [],
                "decrease_likelihood": [],
                "next_questions": [],
                "red_flag": false,
                "red_flag_text": null,
                "notes": null
              }
            }
          ],
          "source_line": 308,
          "inputType": "select"
        },
        {
          "id": "shoulder_q49",
          "question": "Do you experience early morning stiffness?",
          "category": "temporal",
          "answers": [
            {
              "value": "Yes",
              "effects": {
                "rule_out": [],
                "increase_likelihood": [],
                "decrease_likelihood": [],
                "next_questions": [],
                "red_flag": false,
                "red_flag_text": null,
                "notes": null
              }
            },
            {
              "value": "No",
              "effects": {
                "rule_out": [],
                "increase_likelihood": [],
                "decrease_likelihood": [],
                "next_questions": [],
                "red_flag": false,
                "red_flag_text": null,
                "notes": null
              }
            }
          ],
          "source_line": 311,
          "inputType": "select"
        },
        {
          "id": "shoulder_q50",
          "question": "If yes, does the stiffness wane within 30 minutes of waking?",
          "category": "stiffness",
          "answers": [
            {
              "value": "Yes",
              "effects": {
                "rule_out": [],
                "increase_likelihood": [],
                "decrease_likelihood": [],
                "next_questions": [],
                "red_flag": false,
                "red_flag_text": null,
                "notes": null
              }
            },
            {
              "value": "No",
              "effects": {
                "rule_out": [],
                "increase_likelihood": [],
                "decrease_likelihood": [],
                "next_questions": [],
                "red_flag": false,
                "red_flag_text": null,
                "notes": null
              }
            }
          ],
          "source_line": 314,
          "inputType": "select"
        }
      ],
      "recommended_tests": [],
      "confirmation_methods": [
        "Radiographic confirmation – check for distortion of the joint, subchondral sclerosis, osteophyte formation, and narrowing of articular space."
      ],
      "observations": [],
      "source_line": 300
    }
  ],
  "raw_text": "FRACTURES\n\n\n\nOf Clavicle:\n\nAge\n\nWhat region is pain present in?\n\nShoulder\n\nClavicular region\n\nDo you have a recent history of fall or trauma in the affected region?\n\nYes\n\nNo\n\nThe fracture could be pathological (Ask for blood work-up, calcium level, and Vit D intake)\n\nConcerning Pain Features:\n\nHow did the pain begin?\n\nSudden\n\nGradual\n\nDo you experience tingling or abnormal sensations?\n\nYes (Rule out  nerve involvement)\n\nNo\n\nDo you have swelling in the area of complaint?\n\nYes\n\nNo\n\nDid you notice any unusual movement in the area of complaint?\n\nYes\n\nNo\n\nWhat aggravates this pain?\n\nOverhead movement\n\nElevation above shoulder height\n\nABducion of the shoulder\n\nDo you feel pain when you try to raise your arm?\n\nYes\n\nNo\n\nIs there tenderness around the shoulder region or on palpating root of the neck?\n\nYes\n\nNo\n\nIs your sleep affected by pain?\n\nYes\n\nNo\n\nObjective\n\nObservation\t\t\t\t\t\n\nIs shoulder alignment proper?\n\nIf sagging (clavicular #)\n\nIs bruising and swelling present?\n\nYes\n\nNo\n\nIs patient adopting a pain avoidance posture by clasping hands together?\n\nYes\n\nNo\n\nIs there a bump or obvious deformity around the clavicle?\n\nYes\n\nNo\n\n\n\nTEST\n\nRadiographic confirmation. What to expect:\n\nFracture is seen in the middle of the clavicle\n\nCheck for how far out of place the broken fragments are (displacement)\n\n\n\n\n\n\n\n\n\n\n\n\n\n\n\n\n\n\n\n\n\n\n\n\n\n\n\n\n\n\n\n\n\n\n\n\n\n\n\nROTATOR CUFF PATHOLOGIES\n\nFor Shoulder Impingement Syndrome:\n\nWhat region is pain present in?\n\nNeck\n\nNeck and shoulder region\n\nShoulder\n\nDo you experience tingling or abnormal sensations? – \n\nYes\t\t\t (Branch for cervical radiculitis confirmation,)\n\nNo\n\nWhat is the nature of the pain you experience?\n\nSharp or pinching\n\nDull and aching\n\nHow did the pain begin?\n\nSudden\n\nGradual\n\nIf sudden, was it following any of these movements: Abduction ( movement of the arm away from the body sideways), Elevation or External rotation (Rotating shoulder away from the body).\n\nYes\n\nNo\n\nWhat currently aggravates the pain?\n\nArm flexion (Movement of the arm forward)\n\nInternal rotation (Rotating the arm inward)\n\nAbduction\n\nSleeping on the affected side\n\nIf Pain is felt on Abduction and internal rotation, is pain present in the front or lateral part of the shoulder?\n\nYes\n\nNo\n\nDoes your job or daily tasks involve repetitive shoulder movement?\n\nYes\n\nno\n\nOn what movement is the pain felt?\n\nActive\n\nPassive \t\t(Bursitis)\n\nBoth\n\nDo you experience weakness on moving your shoulder?\n\nYes\n\nNo\n\n\n\nFor Subacute tendinitis OR Painfularc syndrome\n\nFor how long have you felt this present pain?\n\nLess than 6 weeks \t\t(Acute)\n\n6 -  less than 12 weeks\t\t(Subacute)\n\n12 weeks or more\t\t(Chronic)\n\nDoes the pain resolve significantly after the precipitating activity is avoided?\n\nYes \t\t  \n\nNo \n\nPalpate the anterior edge of the acromion with the arm in extension and flexion. (Subacute Tendinitis). Is pain present?\n\nYes\n\nNo\n\nFor Chronic Tendinitis (Age: 40-50)\n\nHave you had a previous history of shoulder pain after repetitive use? (Link to question 11, maybe redundant)\n\nYes\n\nNo\n\nDoes pain reduce with rest OR anti-inflammatory use?\n\nYes\n\nNo\n\nIs there tenderness along the bicipital groove or on moving the biceps tendon?\n\nYes (Biccipital tendinitis can co-exist with other rotator cuff pathologies)\n\nNo\n\nFor Cuff Disruption\n\nAre you above 45yrs of age?\n\nYes\n\nNo\n\nDo you have a previous history of sprain or a jerking movement at the shoulder?\n\nYes\n\nNo\n\nCheck if the patient can complete a full abduction of the arm.\n\nIf pt, cannot initiate arm ABduction – full tear\n\nIf active ABduction is possible – partial tear.\n\n\n\n\n\nSPECIAL CONFIRMATORY TESTS\n\nTest for Cervical Radiculitis: \n\nSpurling’s Test\n\nWhile pt is seated, the examiner applies side flexion of the neck towards the affected side while applying axial compression.Sign is positive if the pain sensation felt in the shoulder-neck region is replicated.\n\n\n\nTests for SIS\n\nThe painful arc: Ask pt to Abduct arm across range of motion actively\n\nScapular rhythm is disturbed\n\nPain is aggraavated between the range of 60 - 120 deg\n\nPain is alleviated IF shoulder is laterally rotated on ABduction\n\nIf positive, SIS is indicated\n\nNeer Impingement Sign: Stabilise the scapula with one hand and raise the unaffected side to full flexion with Abduction and internal rotation passively.\n\nThe test is positive when there is pain at the subacromial space.\n\nRule out acromioclavicular osteoarthritis, glenohumeral instability and SLAP lesions.\n\nHawkins-Kennedy Test: Pt arm is placed in 90 deg of elevation at the scapular level and 90 deg flexion; Stabilise the upper arm with one hand and internally rotate with the other hand.\n\nThe test is positive when pain is felt in the anterolateral aspect of the shoulder\n\nJobe’s test: Elevate arm in scapular plane, extend elbow and thumb points towards floor with arm internally rotated. Pt is asked to hold the position with downward pressure from examiner\n\nPositve sign = Pain on examiner restriction indicating supraspinatus irritation.\n\n\n\nTests for Isolated Muscle Weakness\n\nThe ‘Empty Can Test’ for Supraspinatus: Patient is asked to ABduct up to 90 deg, 30 deg flexion and internal rotation. Examiner stands behind patient and applies downward pressure\n\nPositive sign, Affected side is weaker than the unaffected side.\n\nPositive sign suggests tear in the supraspinatus\n\nInfraspinatus Test: Pt holds arms close to body, elbow is flexed up to 90 deg of forward elevation in scapular plane. External rotation is instructed while examiner applies resistance.\n\nLack of power on one side indicates weakness of the infraspinatus muscle\n\n\tIf test is done with arm in 90 deg elevation\n\n\t\ti. Inability to resist external rotation suggests a tear of the infraspinatus\n\n\t\tii. Movement with feelings of pain indicates an irritation to the infraspinatus\n\nSubscapularis (Belly Press Test): Pt is asked to place their hand on their abdomen and move elbow forward. Pt is then asked to press hand on the abdomen.\n\nIf subscapularis is torn, Pt will be unable to perform movement and elbow will move backwards.\n\nLag SignFor External Rotation: Pt lifts arm slightly from body and is asked to hold in external rotation.\n\nPositive when hand recoils to neutral position and suggests tear of infraspinatus or supraspinatus\n\nDrop Sign. The examiner places the arm at 90 deg ABduction, elbow at Rt angle and arm maximally rotated.\n\nPositive sign, arm drops from position. Suggests a tear of the infraspinatus OR the posterior part of the rotator cuff\n\nThe Lift-Off Test (Subscapularis): Pt is asked to place hand on the back at the mid-lumbar spine.The therapist then lifts hand from the back and pt is asked to hold it there\n\nPositive sign, inability to maintain hand while removed suggests subscapularis weakness.\n\n\n\n\n\nFor CALCIFIC TENDINITIS\n\nAcute Calcific Tendinits:\n\nAge \n\n30-35 years \n\nWhat is the pain type?\n\nSharp or pinching\n\nDull and aching\n\nHow did the pain begin?\n\nSudden\n\nGradual\n\nDid the pain increase drastically within a few hours?\n\nYes\n\nNo\n\nDo you experience pain more at night\n\nYes\n\nNo\n\nCan you perform the movements around the shoulder joint?\n\nYes\n\nNo \n\nDoes the pain subside after a few days and the shoulder is restored to normal functioning?\n\nIf Yes ( Acute Calcific Tendinitis)\n\nTest\n\nCheck X-ray to rule asymptomatic calcification\n\nLesions of the Biceps Tendon (Confirmation)\n\nBiccipital Tendinitis as above:\n\nSpecial Test for Biccipital Tendinitis\n\nSpeed Test: Place pt’s arm in shoulder flexion, forearm supination and elbow extension. The examiner then applies pressure to the arm as downward action. \n\nA positive sign, pain in the bicipital grove is replicable\n\nYergasom’s test:  Pt places the forearm in the supine position, and the examiner applies resistance against supination.\n\nA positive sign, this replicates the pain in the bicipital group tenderness.\n\n\n\nRupture of the Biceps Tendon (Confirmation)\n\nAge (over 50yrs)\n\nAsk pt to lift or offer resistance to biceps contraction\n\nIs a prominent lump is seen in lower arm\n\nYes\n\nNo\n\nThe upper arm becomes painful and bruised\t\t\n\nYes\n\nNo\n\nHypertrophy and intra-articular entrapment (the hourglass biceps) -(Confirmation)\n\nAsk patient to elevate the shoulder\n\nIs buckling of tendon present?\n\nYes\n\nNo\n\nDo you feel pain on shoulder elevation?\n\nYes\n\nNo\n\nCan the patient elevate the arm up till the end of the range?\n\nYes\n\nNo\n\nSLAP LESION (Confirmation)\n\nDid you have any history of fall or trauma with hand stretched out?\n\nYes\n\nNo\n\n Did you have any history of loading the shoulder region with weight?\n\nYes\n\nNo\n\nDo you feel a ‘painful click’ when you lift your arm above shoulder height?\n\nYes\n\nNo\n\nDo you feel weakness in your arm when doing activities above shoulder height?\n\nYes\n\nNo\n\nAsk the patient to throw to reach a far distance where above shoulder movement is indicated.\n\nPatient is unable to\n\nPatient is able to\n\nPatient is able to (with pain involvement)\n\n\n\nSpecial Test for SLAP (O’Brien’s test)\n\nInstruct the patient to flex the arm up to 90 deg with the elbow in full extension.Then ask pt to adduct arm 10-15 deg medial to sagittal plane. Arm is maximally internally rotated and examiner applies downward pressure while patient is asked to resist.  Procedure is then repeated in supination\n\nPositive: Pain is elicited by the first manoeuvre, and is reduced or eliminated by the second.\n\n\n\n\n\n\n\n\n\n\n\n\n\n\n\n\n\n\n\n\n\n\n\n\n\n\n\n\n\nADHESIVE CAPSULITIS (Frozen Shoulder Syndrome)\n\nAge (40-60)\n\nAt the early phase of this pain, did you find it difficult to turn your shoulder out (External rotation) and/or take your arm away from your body (abduction)?\n\nYes \t(Check for adhesive capsulitis– early phase. Carry out active and passive movements)\n\nNo\n\nCurrently, do you find it difficult to turn your shoulder in (Internal rotation) or move your arms towards your body/chest (Adduction)\n\nYes\t(Check for adhesive capsulitis – freezing phase)\n\nNo\n\nDo you find it easier to move your shoulder backwards (extension)?\n\nYes\n\nNo\n\nDo you experience progressive stiffness in your shoulder?\n\nYes\n\nNo\n\nIs the pain worse at night?\n\nYes\n\nNo\n\nHave you had any of the following conditions before: Diabetes, Dupuytren’s, hyperlipidemia, hyperthyroidism, cardiac disease, hemiplegia?\n\nYes\n\nNo\n\nHave you undergone a neurosurgical procedure before?\n\nYes\n\nNo\n\nPrevious history of fall or trauma to affected side?\n\nYes \t(Traumatic Adhesive Capsulitis)\n\nNo\t(Non-traumatic Adhesive Capsulitis)\n\n\n\nTest for Adhesive Capsulitis\n\nCheck if the Active range of motion and passive range of motion is full across shoulder joints\n\nActive and Passive range of motion is limited in Adhesive Capsulitis\n\nRule out other causes of stiffness with imaging\n\n\n\n\n\nFOR RECURRENT SHOULDER SUBLUXATION\n\nAge (Young adult: 18-25)\n\nHave you had a previous history of a shoulder dislocation?\n\nYes\n\nNo\n\nDid the first episode occur with a pull on an abducted, laterally rotated-extended arm?\n\nYes\n\nNo\n\nDo you experience a catching sensation followed by numbness or weakness (Dead-arm syndrome) when making overhead arm movements?\n\nYes\t(Rule out rotator cuff disorder and cervical radiculitis)\n\nNo\n\n\n\nSpecial Tests for Recurrent Subluxation\n\nApprehension Test:\n\nPatient is in sitting or lying position, the examiner lifts the arn gently into ABduction, external rotation and then extension. Test is positive if Pt senses that humeral head is about to slip out anteriorly and body stiffens in apprehension.\n\nThe test is repeated with the anterior part of shoulder protected.\n\n\n\nFulcrum’s Test:\n\n\tPt lies supine, arm ABducted up to 90 deg. The examiner places their hands over the shoulder to set the fulcrum base. The humeral head is levered forward by extending and externally rotating arm. The patient immediately becomes apprehensive.\n\nDrawer’s Test:\n\nPatient lies supine , scapula is stabilised with one hand while the upper arm is grasped firmly with the other, and manoeuvring is done forward and backward (like a drawer). The drawer’s test is positive if instability is marked.\n\n\n\n\n\n\n\n\n\n\n\n\n\n\n\nFOR RHEUMATOID ARTHRITIS\n\nGender\n\nCommon in women\n\nDo you have a history of generalised Rheumatoid Arthritis?\n\nYes\n\nNo\n\nDo you experience pain and swelling in both shoulder joints?\n\nYes\n\nNo\n\nDo you smoke?\n\nYes\n\nNo\n\nDo you have episodes of fever that resolve spontaneously?\n\nYes\n\nNo\n\nIs swelling present anteriorly and superiorly to the shoulder?\n\nYes\n\nNo\n\nIs swelling present in the axilla?\n\nYes\n\nNo\n\nDo you experience increasing limitations in performing self-care (styling hair, dressing, shaving)?\n\nYes\n\nNo\n\nTEST \n\nRadiographic confirmation – check for periarticular erosions, subchondral sclerosis, and resorption.\n\n\n\nFOR OSTEOARTHRITIS\n\nAge (50-60 years)\n\nHave you had a previous history of injury, shoulder dislocation, or painful arc syndrome?\n\nYes\n\nNo\n\nDo you feel the pain more at night?\n\nYes\t(Rule out adhesive capsulitis)\n\nNo\n\nIs your shoulder movement restricted across ALL joint motions?\n\nYes\t\n\nNo\t (Rule out Adhesive Capsulitis. Extension is free in Adhesive Capsulitis)\n\nDo you experience early morning stiffness?\n\nYes\n\nNo\n\nIf yes, does the stiffness wane within 30 minutes of waking?\n\nYes\n\nNo \n\nTEST\n\nRadiographic confirmation – check for distortion of the joint, subchondral sclerosis, osteophyte formation, and narrowing of articular space.\n\n\n\n",
  "extraction_messages": []
}